Name,Description,Latitude,Longitude,InfoURL,ImageURL
UCSB,A great university located along the California coast!,34.416929,-119.845991,"https://en.wikipedia.org/wiki/University_of_California,_Santa_Barbara",https://www.history.ucsb.edu/wp-content/uploads/LagoonFall20141.jpg
Beijing Institude of Technology,A Chinese University where I wrote my first Scientific Research paper and published it!,39.9603,116.3124,https://en.wikipedia.org/wiki/Beijing_Institute_of_Technology,http://mmbiz.qpic.cn/mmbiz/ToiaibS5Fic6AIbKuGBy2u3kuVickTO4ZoQ17HLU8L5ZGe2iaB3VRvjds1c1xFRSdpzI6dGyia0ib4WulYdXMGyBq3TBA/640?wx_fmt=jpeg&tp=webp&wxfrom=5&wx_lazy=1
Dalian,A coastal city where I was born and rasied; Famous for its soccer atmosphere,39.02051,121.5626,https://zh.wikipedia.org/wiki/%E5%A4%A7%E8%BF%9E%E4%BD%93%E8%82%B2%E4%B8%AD%E5%BF%83,http://www.biyanzlok.com/statics/uploads/2017/01/17/1484633640176237.jpg
Guang Zhou (China Exports and Import Fairs),"It is the oldest, largest, and the most representative trade fair in China. I have attended this Fair with my father since I was a kid. My photo on my  Fair ID is still a picture took when I was 3 years old. P,S, My father's company is called Lucky Johnny. LOL",23.12991,113.2648,https://en.wikipedia.org/wiki/Canton_Fair,http://www.xinhuanet.com/english/2018-11/04/137581658_15413429418631n.jpg
New York,I took my first SAT here. Gotten to understand American culture better. (I have to say that California's environment is way better than New York),40.71278,-74.0059,https://en.wikipedia.org/wiki/New_York_City,https://upload.wikimedia.org/wikipedia/commons/9/9d/NYC_Montage_2014_4_-_Jleon.jpg
Gold Coast,My favoutie surfing spot! I have visited there twice and seen surfers surfing along the coast. I hope I can learn how to surf oneday.,-28.01848,153.4022,"https://en.wikipedia.org/wiki/Gold_Coast,_Queensland",https://cdn2.veltra.com/ptr/20170726063045_1443289941_13572_0.jpg?imwidth=240&impolicy=custom
